{
  "id": "paldea-evolved-booster-pack",
  "name": "Paldea Evolved Booster Pack",
  "category": "booster-pack",
  "releaseDate": "2023-06-09",
  "identifiers": {
    "tcgplayer": "493976"
  },
  "images": [
    {
      "type": "front",
      "url": "https://tcgplayer-cdn.tcgplayer.com/product/493976_in_1000x1000.jpg"
    }
  ],
  "contents": [
    {
      "type": "booster",
      "set": "sv02",
      "quantity": 1
    }
  ],
  "description": "Each pack contains 10 cards.",
  "sources": [],
  "status": "draft",
  "migration": {
    "originalId": "product-170"
  }
}
