{
  "id": "pitch-black-build-and-battle-box",
  "name": "Pitch Black Build & Battle Box",
  "category": "build-and-battle-box",
  "releaseDate": "2026-07-17",
  "identifiers": {
    "tcgplayer": "692946"
  },
  "images": [
    {
      "type": "front",
      "url": "https://tcgplayer-cdn.tcgplayer.com/product/692946_in_1000x1000.jpg"
    }
  ],
  "contents": [
    {
      "type": "booster",
      "set": "me05",
      "quantity": 4
    }
  ],
  "description": "Each Build & Battle Box contains a 40-card ready-to-play deck, 4 booster packs, 1 promo card, and a code card for Pokémon TCG Live.",
  "sources": [],
  "status": "draft",
  "migration": {
    "originalId": "product-100"
  }
}
