{
  "id": "paradox-rift-build-and-battle-stadium",
  "name": "Paradox Rift Build & Battle Stadium",
  "category": "build-and-battle-stadium",
  "releaseDate": "2023-11-03",
  "identifiers": {
    "tcgplayer": "514070"
  },
  "images": [
    {
      "type": "front",
      "url": "https://tcgplayer-cdn.tcgplayer.com/product/514070_in_1000x1000.jpg"
    }
  ],
  "contents": [
    {
      "type": "booster",
      "set": "sv04",
      "quantity": 11
    }
  ],
  "description": "Each Build & Battle Stadium contains 2 Build & Battle Boxes, 3 Booster Packs, 121 Energy cards, 6 damage-counter dice, 1 competition-legal coin-flip die, 2 condition markers, and a box to hold everything.",
  "sources": [],
  "status": "draft",
  "migration": {
    "originalId": "product-248"
  }
}
