{
  "id": "paldean-fates-international-tin-charizard-ex",
  "name": "Paldean Fates International Tin [Charizard ex]",
  "category": "tin",
  "releaseDate": "2024-02-09",
  "identifiers": {
    "tcgplayer": "528063"
  },
  "images": [
    {
      "type": "front",
      "url": "https://tcgplayer-cdn.tcgplayer.com/product/528063_in_1000x1000.jpg"
    }
  ],
  "contents": [
    {
      "type": "booster",
      "set": "sv04.5",
      "quantity": 5
    },
    {
      "type": "promo-card",
      "card": "svp-074",
      "quantity": 1
    }
  ],
  "description": "Each Tin contains 5 Booster Packs and 1 promo card.",
  "sources": [],
  "status": "draft",
  "migration": {
    "originalId": "product-280"
  }
}
