{
  "id": "mega-evolution-premium-checklane-blister-tyranitar",
  "name": "Mega Evolution Premium Checklane Blister [Tyranitar]",
  "category": "premium-checklane-blister",
  "releaseDate": "2025-09-26",
  "images": [
    {
      "type": "front",
      "url": "https://tcgplayer-cdn.tcgplayer.com/product/644361_in_1000x1000.jpg"
    }
  ],
  "contents": [
    {
      "type": "booster",
      "set": "me01",
      "quantity": 1
    },
    {
      "type": "promo-card",
      "cards": [
        "sv09-080",
        "sv09-081"
      ],
      "quantity": 2
    },
    {
      "type": "promo-card",
      "card": "sv09-095",
      "quantity": 1,
      "stamp": "cosmos"
    },
    {
      "type": "accessory",
      "category": "coin",
      "quantity": 1,
      "name": "Lucario"
    }
  ],
  "description": "Each Premium Checklane Blister contains 1 booster pack, 3 promo card(s), and a coin.",
  "sources": [],
  "status": "draft",
  "migration": {
    "originalId": "product-29",
    "warnings": [
      "TCGplayer ID 644361 was shared with the Meowscarada blister — likely a data-entry error. Correct ID needs manual lookup."
    ]
  }
}
