{
  "id": "paldea-evolved-sleeved-booster-case",
  "name": "Paldea Evolved Sleeved Booster Case",
  "category": "case",
  "releaseDate": "2023-06-09",
  "identifiers": {
    "tcgplayer": "609027"
  },
  "images": [
    {
      "type": "front",
      "url": "https://tcgplayer-cdn.tcgplayer.com/product/609027_in_1000x1000.jpg"
    }
  ],
  "contents": [
    {
      "type": "sealed-product",
      "product": "paldea-evolved-sleeved-booster-pack",
      "quantity": 144
    }
  ],
  "description": "Each Sleeved Booster Case contains 144 Sleeved Booster Packs.",
  "sources": [],
  "status": "draft",
  "migration": {
    "originalId": "product-187"
  }
}
