{
  "id": "sams-club-151-4-mini-tins-4-promo-cards-bundle",
  "name": "Sam's Club 151 (4 Mini Tins + 4 Promo Cards Bundle)",
  "category": "other",
  "releaseDate": "2025-10-28",
  "identifiers": {
    "tcgplayer": "662302"
  },
  "images": [
    {
      "type": "front",
      "url": "https://tcgplayer-cdn.tcgplayer.com/product/662302_in_1000x1000.jpg"
    }
  ],
  "contents": [
    {
      "type": "booster",
      "set": "sv03.5",
      "quantity": 8
    },
    {
      "type": "promo-card",
      "cards": [
        "sv03.5-026",
        "sv03.5-068",
        "sv03.5-094",
        "sv03.5-149"
      ],
      "quantity": 4,
      "stamp": "cosmos-holo"
    }
  ],
  "description": "Each Bundle contains 4 Mini Tins and 4 promo cards.",
  "sources": [],
  "status": "draft",
  "migration": {
    "originalId": "product-221"
  }
}
