{
  "id": "ascended-heroes-mini-tin-clefairy-and-chikorita",
  "name": "Ascended Heroes Mini Tin [Clefairy & Chikorita]",
  "category": "mini-tin",
  "releaseDate": "2026-02-20",
  "identifiers": {
    "tcgplayer": "668535"
  },
  "images": [
    {
      "type": "front",
      "url": "https://tcgplayer-cdn.tcgplayer.com/product/668535_in_1000x1000.jpg"
    }
  ],
  "contents": [
    {
      "type": "booster",
      "set": "me02.5",
      "quantity": 2
    }
  ],
  "description": "Each Mini Tin contains 2 booster packs and an art card.",
  "sources": [],
  "status": "draft",
  "migration": {
    "originalId": "product-133"
  }
}
