{
  "id": "obsidian-flames-single-pack-blister-paldean-wooper",
  "name": "Obsidian Flames Single Pack Blister [Paldean Wooper]",
  "category": "single-pack-blister",
  "releaseDate": "2023-08-11",
  "identifiers": {
    "tcgplayer": "512047"
  },
  "images": [
    {
      "type": "front",
      "url": "https://tcgplayer-cdn.tcgplayer.com/product/512047_in_1000x1000.jpg"
    }
  ],
  "contents": [
    {
      "type": "booster",
      "set": "sv03",
      "quantity": 1
    },
    {
      "type": "promo-card",
      "card": "svp-041",
      "quantity": 1,
      "stamp": "cosmos-holo"
    }
  ],
  "description": "Each Single Pack Blister contains 1 booster pack, 1 promo card, and a coin.",
  "sources": [],
  "status": "draft",
  "migration": {
    "originalId": "product-200"
  }
}
