{
  "id": "phantasmal-flames-booster-box",
  "name": "Phantasmal Flames Booster Box",
  "category": "booster-box",
  "releaseDate": "2025-11-14",
  "identifiers": {
    "tcgplayer": "654137"
  },
  "images": [
    {
      "type": "front",
      "url": "https://tcgplayer-cdn.tcgplayer.com/product/654137_in_1000x1000.jpg"
    }
  ],
  "contents": [
    {
      "type": "booster",
      "set": "me02",
      "quantity": 36
    }
  ],
  "description": "Each Booster Box contains 36 booster packs.",
  "sources": [],
  "status": "draft",
  "migration": {
    "originalId": "product-31"
  }
}
