{
  "id": "151-booster-bundle",
  "name": "151 Booster Bundle",
  "category": "booster-bundle",
  "releaseDate": "2023-09-22",
  "identifiers": {
    "tcgplayer": "502000"
  },
  "images": [
    {
      "type": "front",
      "url": "https://tcgplayer-cdn.tcgplayer.com/product/502000_in_1000x1000.jpg"
    }
  ],
  "contents": [
    {
      "type": "booster",
      "set": "sv03.5",
      "quantity": 6
    }
  ],
  "description": "Each Booster Bundle contains 6 booster packs.",
  "sources": [],
  "status": "draft",
  "migration": {
    "originalId": "product-214"
  }
}
